{
  "kind": "DeviceActuationBoundaryReceipt",
  "receipt_id": "actuation-receipt:high-risk-payment-denied-002",
  "action_proposal_id": "proposal:payment-initiate-transfer",
  "action_class": "payment",
  "capability_class": "high_risk",
  "actuation_target": {
    "target_id": "payment://account/checking/transfer",
    "target_type": "payment_transfer",
    "target_description": "Initiate transfer from checking account"
  },
  "proposal_status": "denied",
  "policy_decision_ref": "policy-fabric://decision/pd-payment-high-risk-denied-002",
  "policy_outcome": "deny",
  "denial_reason": "High-risk payment action requires explicit human approval and narrow delegated authority. No approval_ref or approval_authority_ref present in this execution context.",
  "evidence_refs": [
    "evidence://agentplane/device-actuation/high-risk-payment-denied-002"
  ],
  "hellgraph_evidence_refs": [
    "evidence://hellgraph/device-actuation/high-risk-payment-denied-002"
  ],
  "upstream_anchors": [
    "prophet-platform://strategy/sovereign-device-orchestration",
    "agentplane#111"
  ],
  "non_claims": [
    "No payment was initiated. This receipt records a denied proposal only.",
    "This receipt does not store account numbers, amounts, or payment credentials."
  ],
  "issued_at": "2024-01-15T14:05:00Z"
}
